{
  "case_count": 27,
  "cases": [
    {
      "case_id": "case.01.wording",
      "changed_paths": [
        "/wording"
      ],
      "dimension": "wording",
      "expected_local_relation": {
        "direction": null,
        "kind": "invariant",
        "rationale_code": "wording.local.expectation",
        "state": "EXPECTED"
      },
      "local_official_agreement": {
        "state": "MISSING",
        "value": null
      },
      "official_relation": {
        "state": "MISSING",
        "value": null
      },
      "operation": "replace",
      "parent_id": "source.01.language",
      "partition": "development",
      "seed": 1402001,
      "source_cluster_id": "cluster.01.language",
      "source_fingerprint": "sha256:e4be7bec235e8bb329fd2528dbc80bdc439892a42fe8314d7f381c1cd7df0eeb",
      "target_path": "/wording",
      "variant_fingerprint": "sha256:22a59ea599601913b7788e839e2b504bcd70a98f1b0263ea5917d1dc8459de12",
      "variant_material": {
        "ambiguity": "none",
        "assets": [
          {
            "asset_id": "image_a",
            "modality": "image",
            "role": "first_frame"
          },
          {
            "asset_id": "video_a",
            "modality": "video",
            "role": "reference"
          },
          {
            "asset_id": "audio_a",
            "modality": "audio",
            "role": "reference_audio"
          }
        ],
        "camera": "static",
        "conflicts": [],
        "dialogue": "Welcome home.",
        "directives": [
          {
            "action": "retain",
            "target": "subject_a"
          }
        ],
        "distractors": [],
        "duration_ms": 4000,
        "metadata": {
          "language": "en",
          "normalization": "NFC"
        },
        "motion": "subject_walks_slowly",
        "style": "natural_documentary",
        "subjects": [
          {
            "source": "image_a",
            "subject_id": "subject_a"
          }
        ],
        "timeline": [
          {
            "end_ms": 1000,
            "event_id": "event_a",
            "start_ms": 0
          },
          {
            "end_ms": 2000,
            "event_id": "event_b",
            "start_ms": 1000
          },
          {
            "end_ms": 3000,
            "event_id": "event_c",
            "start_ms": 2000
          }
        ],
        "timeline_offset_ms": 0,
        "unsupported_inputs": [],
        "video_audio": {
          "mode": "retain",
          "source": "video_a"
        },
        "visible_text": "OPEN",
        "wording": "A measured opening."
      }
    },
    {
      "case_id": "case.02.unicode",
      "changed_paths": [
        "/visible_text"
      ],
      "dimension": "unicode",
      "expected_local_relation": {
        "direction": null,
        "kind": "invariant",
        "rationale_code": "unicode.local.expectation",
        "state": "EXPECTED"
      },
      "local_official_agreement": {
        "state": "MISSING",
        "value": null
      },
      "official_relation": {
        "state": "MISSING",
        "value": null
      },
      "operation": "replace",
      "parent_id": "source.01.language",
      "partition": "development",
      "seed": 1402002,
      "source_cluster_id": "cluster.01.language",
      "source_fingerprint": "sha256:e4be7bec235e8bb329fd2528dbc80bdc439892a42fe8314d7f381c1cd7df0eeb",
      "target_path": "/visible_text",
      "variant_fingerprint": "sha256:81a8d9dd41386b4fd9ff0a71fc49a3b8d7292d0d52ce749d0d881f6fe31c0aff",
      "variant_material": {
        "ambiguity": "none",
        "assets": [
          {
            "asset_id": "image_a",
            "modality": "image",
            "role": "first_frame"
          },
          {
            "asset_id": "video_a",
            "modality": "video",
            "role": "reference"
          },
          {
            "asset_id": "audio_a",
            "modality": "audio",
            "role": "reference_audio"
          }
        ],
        "camera": "static",
        "conflicts": [],
        "dialogue": "Welcome home.",
        "directives": [
          {
            "action": "retain",
            "target": "subject_a"
          }
        ],
        "distractors": [],
        "duration_ms": 4000,
        "metadata": {
          "language": "en",
          "normalization": "NFC"
        },
        "motion": "subject_walks_slowly",
        "style": "natural_documentary",
        "subjects": [
          {
            "source": "image_a",
            "subject_id": "subject_a"
          }
        ],
        "timeline": [
          {
            "end_ms": 1000,
            "event_id": "event_a",
            "start_ms": 0
          },
          {
            "end_ms": 2000,
            "event_id": "event_b",
            "start_ms": 1000
          },
          {
            "end_ms": 3000,
            "event_id": "event_c",
            "start_ms": 2000
          }
        ],
        "timeline_offset_ms": 0,
        "unsupported_inputs": [],
        "video_audio": {
          "mode": "retain",
          "source": "video_a"
        },
        "visible_text": "入口 Café",
        "wording": "A quiet opening for language."
      }
    },
    {
      "case_id": "case.03.metadata",
      "changed_paths": [
        "/metadata"
      ],
      "dimension": "metadata",
      "expected_local_relation": {
        "direction": null,
        "kind": "invariant",
        "rationale_code": "metadata.local.expectation",
        "state": "EXPECTED"
      },
      "local_official_agreement": {
        "state": "MISSING",
        "value": null
      },
      "official_relation": {
        "state": "MISSING",
        "value": null
      },
      "operation": "replace",
      "parent_id": "source.01.language",
      "partition": "development",
      "seed": 1402003,
      "source_cluster_id": "cluster.01.language",
      "source_fingerprint": "sha256:e4be7bec235e8bb329fd2528dbc80bdc439892a42fe8314d7f381c1cd7df0eeb",
      "target_path": "/metadata",
      "variant_fingerprint": "sha256:62296e4c0873e6a1c6fba1f7dfa49e990e8466fbda72a21b23b57377d9cf8588",
      "variant_material": {
        "ambiguity": "none",
        "assets": [
          {
            "asset_id": "image_a",
            "modality": "image",
            "role": "first_frame"
          },
          {
            "asset_id": "video_a",
            "modality": "video",
            "role": "reference"
          },
          {
            "asset_id": "audio_a",
            "modality": "audio",
            "role": "reference_audio"
          }
        ],
        "camera": "static",
        "conflicts": [],
        "dialogue": "Welcome home.",
        "directives": [
          {
            "action": "retain",
            "target": "subject_a"
          }
        ],
        "distractors": [],
        "duration_ms": 4000,
        "metadata": {
          "language": "zh_Hant",
          "normalization": "NFC"
        },
        "motion": "subject_walks_slowly",
        "style": "natural_documentary",
        "subjects": [
          {
            "source": "image_a",
            "subject_id": "subject_a"
          }
        ],
        "timeline": [
          {
            "end_ms": 1000,
            "event_id": "event_a",
            "start_ms": 0
          },
          {
            "end_ms": 2000,
            "event_id": "event_b",
            "start_ms": 1000
          },
          {
            "end_ms": 3000,
            "event_id": "event_c",
            "start_ms": 2000
          }
        ],
        "timeline_offset_ms": 0,
        "unsupported_inputs": [],
        "video_audio": {
          "mode": "retain",
          "source": "video_a"
        },
        "visible_text": "OPEN",
        "wording": "A quiet opening for language."
      }
    },
    {
      "case_id": "case.04.asset_order",
      "changed_paths": [
        "/assets"
      ],
      "dimension": "asset_order",
      "expected_local_relation": {
        "direction": null,
        "kind": "covariant",
        "rationale_code": "asset_order.local.expectation",
        "state": "EXPECTED"
      },
      "local_official_agreement": {
        "state": "MISSING",
        "value": null
      },
      "official_relation": {
        "state": "MISSING",
        "value": null
      },
      "operation": "reorder",
      "parent_id": "source.02.assets",
      "partition": "development",
      "seed": 1402004,
      "source_cluster_id": "cluster.02.assets",
      "source_fingerprint": "sha256:3b307687e6c53861b5d912a80eacb40f2e5871798fc0c6f6add2c91ffe8a8039",
      "target_path": "/assets",
      "variant_fingerprint": "sha256:54a9488de1b2bd49430b9a0857df0acbe420360e1d50521cacb7e3ae747e90d1",
      "variant_material": {
        "ambiguity": "none",
        "assets": [
          {
            "asset_id": "audio_a",
            "modality": "audio",
            "role": "reference_audio"
          },
          {
            "asset_id": "image_a",
            "modality": "image",
            "role": "first_frame"
          },
          {
            "asset_id": "video_a",
            "modality": "video",
            "role": "reference"
          }
        ],
        "camera": "static",
        "conflicts": [],
        "dialogue": "Welcome home.",
        "directives": [
          {
            "action": "retain",
            "target": "subject_a"
          }
        ],
        "distractors": [],
        "duration_ms": 4000,
        "metadata": {
          "language": "en",
          "normalization": "NFC"
        },
        "motion": "subject_walks_slowly",
        "style": "natural_documentary",
        "subjects": [
          {
            "source": "image_a",
            "subject_id": "subject_a"
          }
        ],
        "timeline": [
          {
            "end_ms": 1000,
            "event_id": "event_a",
            "start_ms": 0
          },
          {
            "end_ms": 2000,
            "event_id": "event_b",